<?xml version="1.0" encoding="UTF-8"?>
<glossary   xmlns="glossary"
            xmlns:xsi="http://www.w3.org/2001/XMLSchema-instance"
            xsi:schemaLocation="schema.xsd">
    <term>
        <word>MaaS</word>
        <extended>MongoDB as an Admin Service</extended>
        <definition>Progetto</definition>
    </term>
    <term>
        <word>Prova</word>
        <definition>Definizione di prova</definition>
    </term>
    <term>
        <word>Multiple</word>
        <extended>Parola con definizioni multiple</extended>
        <definition>Definizione 1</definition>
        <definition>Definizione 2</definition>
        <definition>Definizione 3</definition>
    </term>
</glossary>